{
 "playbook_id": "playbook-subset-04",
 "kind": "remediation-playbook",
 "generated_at": "2026-08-10T10:56:33+00:00",
 "source": "OWASP Cheat Sheet Series, OWASP Top 10:2021 and OWASP API Security Top 10:2023, retrieved verbatim from OWASP-owned sources. principles, preserve and common_mistakes are authored for this target.",
 "general_guidance": "## Applies to every task\n\n**Fix the defect, keep the feature.** Both are measured. A change that closes the\nweakness and breaks working behaviour is scored as a failure, not a partial\nsuccess. Removing a route, gutting a handler, or making an endpoint fail\nunconditionally is never an acceptable remediation.\n\n**Fail closed.** When a check cannot reach a decision \u2014 a header is missing, a\nvalue will not parse, a dependency is unavailable \u2014 refuse. An error path that\nfalls through to \"allow\" is the defect in a new place.\n\n**Enforce on the server.** Client-side validation is a usability feature. Anything\nthe client sends, including headers, identifiers and flags, is attacker-controlled.\n\n**Validate what you use.** If a value is decoded, normalised, trimmed or truncated\nbetween the check and the use, the check ran against a different string.\n\n**Allow-list, don't deny-list.** Enumerate what is permitted and reject the rest.\nA deny-list is a guess about every input you have not thought of yet.\n\n**Fix the mechanism, not the instance.** Where several inputs reach the same weak\npoint, address the weak point. Handling the one input named in the report leaves\nthe others open.\n\n**Smallest change that closes it.** No reformatting, renaming, dependency changes\nor unrelated cleanup \u2014 each one adds a way to break something and makes the real\nchange harder to review.\n\n**Keep the public contract.** Same paths, verbs, success-path response shapes and\nstatus codes.\n\n**Never modify tests.** They are how the work is judged. If a test fails after\nyour change, the change is wrong or incomplete.\n",
 "entries": [
  {
   "entry_id": "path-and-filename-validation",
   "title": "Serving files from user-supplied paths",
   "owasp_codes": [
    "A05"
   ],
   "classes": [
    "Security Misconfiguration / Sensitive File Exposure",
    "Security Misconfiguration / Path Filter Bypass",
    "Security Misconfiguration / Improper Input Handling"
   ],
   "guidance": "### From https://cheatsheetseries.owasp.org/cheatsheets/Input_Validation_Cheat_Sheet.html\n\n# Input Validation Cheat Sheet\n\n## Introduction\n\nThis article is focused on providing clear, simple, actionable guidance for providing Input Validation security functionality in your applications.\n\n## Goals of Input Validation\n\nInput validation is performed to ensure only properly formed data is entering the workflow in an information system, preventing malformed data from persisting in the database and triggering malfunction of various downstream components. Input validation should happen as early as possible in the data flow, preferably as soon as the data is received from the external party.\n\nData from all potentially untrusted sources should be subject to input validation, including not only Internet-facing web clients but also backend feeds over extranets, from [suppliers, partners, vendors or regulators](https://badcyber.com/several-polish-banks-hacked-information-stolen-by-unknown-attackers/), each of which may be compromised on their own and start sending malformed data.\n\nInput Validation should not be used as the *primary* method of preventing [XSS](Cross_Site_Scripting_Prevention_Cheat_Sheet.md), [SQL Injection](SQL_Injection_Prevention_Cheat_Sheet.md) and other attacks which are covered in respective [cheat sheets](https://cheatsheetseries.owasp.org/) but can significantly contribute to reducing their impact if implemented properly.\n\n## Input Validation Strategies\n\nInput validation should be applied at both syntactic and semantic levels:\n\n- **Syntactic** validation should enforce correct syntax of structured fields (e.g. SSN, date, currency symbol).\n- **Semantic** validation should enforce correctness of their *values* in the specific business context (e.g. start date is before end date, price is within expected range).\n\nIt is always recommended to prevent attacks as early as possible in the processing of the user's (attacker's) request. Input validation can be used to detect unauthorized input before it is processed by the application.\n\n## Implementing Input Validation\n\nInput validation can be implemented using any programming technique that allows effective enforcement of syntactic and semantic correctness, for example:\n\n- Use data type validators available natively in web application frameworks (such as [Django Validators](https://docs.djangoproject.com/en/1.11/ref/validators/), [Apache Commons Validators](https://commons.apache.org/proper/commons-validator/apidocs/org/apache/commons/validator/package-summary.html#doc.Usage.validator) etc).\n- Validation against [JSON Schema](http://json-schema.org/) and [XML Schema (XSD)](https://www.w3schools.com/xml/schema_intro.asp) for input in these formats.\n- Type conversion (e.g. `Integer.parseInt()` in Java, `int()` in Python) with strict exception handling\n- Minimum and maximum value range check for numerical parameters and dates, minimum and maximum length check for strings.\n- Array of allowed values for small sets of string parameters (e.g. days of week).\n- Regular expressions for any other structured data covering the whole input string `(^...$)` and **not** using \"any character\" wildcard (such as `.` or `\\S`)\n- Denylisting known dangerous patterns can be used as an additional layer of defense, but it should supplement - not replace - allowlisting, to help catch some commonly observed attacks or patterns without relying on it as the main validation method.\n\n### Allowlist vs Denylist\n\nIt is a common mistake to use denylist validation in order to try to detect possibly dangerous characters and patterns like the apostrophe `'` character, the string `1=1`, or the `<script>` tag, but this is a massively flawed approach as it is trivial for an attacker to bypass such filters.\n\nPlus, such filters frequently prevent authorized input, like `O'Brian`, where the `'` character is fully legitimate. For more information on XSS filter evasion please see [this wiki page](https://owasp.org/www-community/xss-filter-evasion-cheatsheet).\n\nWhile denylisting can be useful as an additional layer of defense to catch some common malicious patterns, it should not be relied upon as the primary method. Allowlisting remains the more robust and secure approach for preventing potentially harmful input.\n\nAllowlist validation is appropriate for all input fields provided by the user. Allowlist validation involves defining exactly what IS authorized, and by definition, everything else is not authorized.\n\nIf it's well structured data, like dates, social security numbers, zip codes, email addresses, etc. then the developer should be able to define a very strong validation pattern, usually based on regular expressions, for validating such input.\n\nIf the input field comes from a fixed set of options, like a drop down list or radio buttons, then the input needs to match exactly one of the values offered to the user in the first place. Any failure to validate a value against this discrete list of options on the server side is a high security event and should be logged as a high severity event as it indicates that an attacker is tampering with the client-side code.\n\n### Validating Free-form Unicode Text\n\nFree-form text, especially with Unicode characters, is perceived as difficult to validate due to a relatively large space of characters that need to be allowed.\n\nIt's also free-form text input that highlights the importance of proper context-aware output encoding and quite clearly demonstrates that input validation is **not** the primary safeguards against Cross-Site Scripting. If your users want to type apostrophe `'` or less-than sign `<` in their comment field, they might have perfectly legitimate reason for that and the application's job is to properly handle it throughout the whole life cycle of the data.\n\nThe primary means of input validation for free-form text input should be:\n\n- **Normalization:** Ensure canonical encoding is used across all the text and no invalid characters are present.\n- **Character category allowlisting:** Unicode allows listing categories such as \"decimal digits\" or \"letters\" which not only covers the Latin alphabet but also various other scripts used globally (e.g. Arabic, Cyrillic, CJK ideographs etc).\n- **Individual character allowlisting:** If you allow letters and ideographs in names and also want to allow apostrophe `'` for Irish names, but don't want to allow the whole punctuation category.\n\nReferences:\n\n- [Input validation of free-form Unicode text in Python](https://web.archive.org/web/20170717174432/https://ipsec.pl/python/2017/input-validation-free-form-unicode-text-python.html/)\n- [UAX 31: Unicode Identifier and Pattern Syntax](https://unicode.org/reports/tr31/)\n- [UAX 15: Unicode Normalization Forms](https://www.unicode.org/reports/tr15/)\n- [UAX 24: Unicode Script Property](https://unicode.org/reports/tr24/)\n\n### Regular Expressions (Regex)\n\nDeveloping regular expressions can be complicated, and is well beyond the scope of this cheat sheet.\n\nThere are lots of resources on the internet about how to write regular expressions, including this [site](https://www.regular-expressions.info/) and the [OWASP Validation Regex Repository](https://owasp.org/www-community/OWASP_Validation_Regex_Repository).\n\nWhen designing regular expressions, be aware of [RegEx Denial of Service (ReDoS) attacks](https://owasp.org/www-community/attacks/Regular_expression_Denial_of_Service_-_ReDoS). These attacks cause a program using a poorly designed Regular Expression to operate very slowl